id,datetime,impact,headline,summary
124752088,2023-12-28 16:02:21,n/a,"Morgan Stanley, Starbucks, Tesla: 2024 leadership in focus","Various companies have experienced a changing of the guard in leadership in 2023. With 2024 just days away, these companies and fresh CEOs prepare to face new challenges. Three companies in particular are in focus for many investors next year — Morgan Stanley (MS), Starbucks (SBUX), and Tesla (TSLA). Morgan Stanley will have new leadership in CEO Ted Pick, succeeding James Gorman who will stay on as executive chairman for one year. Pick has been with the company since 1990, starting as an analyst and was involved in capital-raising activities during the 2008 financial crisis. Starbucks CEO Laxman Narasimhan will face ongoing challenges in handling growing unionization efforts across Starbucks locations nationwide. Ongoing union pushes and calls for boycotts, which have reportedly cost the coffee chain $11 billion in value, will be an uphill battle for Narasimhan. Lastly, Tesla CEO Elon Musk will be under close watch as multiple headwinds for the company mount including massive recalls, unionization efforts in Europe, and Musk's time spent as leader of multiple companies including the Boring Company and X.com (formerly Twitter). Yahoo Finance Anchors Brad Smith and Brian Sozzi break down the latest developments with these company leaders and the challenges they will face in 2024. For more Yahoo Finance coverage of Tesla: Tesla: Is Elon Musk too distracted by his other companies? Catalysts for Tesla stock in 2024 Tesla is 'the AI company': Analyst Tesla: Car buyers missing out 'because they don't like Elon' Musk's social commentary hurting Tesla, other brands: Bill George For more expert insight and the latest market action, click here to watch this full episode of Yahoo Finance Live."
124752089,2023-12-28 15:49:58,n/a,Tesla: Is Elon Musk too distracted by his other companies?,"Tesla (TSLA) investors have been increasingly anxious about CEO Elon Musk's focus on the EV maker while juggling his various other projects and companies, including X, SpaceX, and the Boring Company. Yahoo Finance Live examines potential distractions for Musk and whether these priorities could weigh down Tesla's stock and its EV production goals heading into 2024. For more Yahoo Finance coverage of Tesla: Morgan Stanley, Starbucks, Tesla: 2024 leadership in focus Catalysts for Tesla stock in 2024 Tesla is 'the AI company': Analyst Tesla: Car buyers missing out 'because they don't like Elon' Musk's social commentary hurting Tesla, other brands: Bill George For more expert insight and the latest market action, click here to watch this full episode of Yahoo Finance Live."
124755001,2023-12-28 15:39:00,n/a,China's Xiaomi unveils first electric vehicle SU7 set for 2024 launch,Looking for stock market analysis and research with proves results? Zacks.com offers in-depth financial research with over 30years of proven results.
124752090,2023-12-28 15:27:00,n/a,"Tesla Robot Injures Worker, Report Says. The Plant Is Safer Than Average.","Tesla is heading into next year on a high note as its stock has more than doubled in 2023.  Media reports of a robot injuring a worker at one of its factories aren’t putting off market analysts, who are more interested in the electric-vehicle company’s next delivery figures.  Tesla didn’t respond to a request for comment, but CEO Elon Musk pointed out via a tweet that the machine involved in the incident was a robotic arm common in manufacturing plants."
124752091,2023-12-28 15:24:00,n/a,Elon Musk fires back at 'truly shameful' media report on Tesla Gigafactory worker injury,"Tesla  CEO Elon Musk has made no secret about his disdain for the mainstream media in recent years.  Despite numerous appearances on some of the most high profile media outlets in exclusive interviews and conversations, on X, formerly known as Twitter, Musk plays heavily to the anti-media crowd.  Like any fallible human being, some of Musk's criticisms are spot on, while many others miss the mark entirely."
124752092,2023-12-28 15:15:00,n/a,Tesla Trading Strategy: Here's How We're Playing the Enigmatic Stock,"Tesla  continues to be a controversial and enigmatic stock.  Technically, Tesla has broken out of a symmetrical triangle pattern (dotted lines).  The bullish breakout surpassed our secondary entry point for the stock, meaning we now have a normal-sized position."
124744361,2023-12-28 14:48:00,n/a,Smartphone giant targets Tesla and Porsche with huge new unveiling,Chinese consumer electronics and smartphone giant Xiaomi  Thursday unveiled its first foray into the electric-vehicle market: the Xiaomi SU7.  During the event Founder and CEO Lei Jun revealed the company's ambition to grow Xiaomi into one of the world's most prominent automakers.
124752094,2023-12-28 14:28:42,n/a,China’s Xiaomi dreams of building a car ‘as good as’ Porsche and Tesla,"Xiaomi has unveiled its first electric car, just days after Huawei launched another one of its own, showing that the efforts of Chinese tech giants to join the electric vehicle race are beginning to bear fruit."
124748759,2023-12-28 12:38:00,n/a,This Is How Elon Musk Got Rich,Looking for stock market analysis and research with proves results? Zacks.com offers in-depth financial research with over 30years of proven results.
124748760,2023-12-28 12:15:00,n/a,Tesla CEO Elon Musk Slams Report Of Robot 'Attacking' Employee At Giga Texas: 'Truely Shameful',Looking for stock market analysis and research with proves results? Zacks.com offers in-depth financial research with over 30years of proven results.
124748761,2023-12-28 12:02:00,n/a,"Tesla's Q4: Analysts Expect Record Deliveries, But Miss On 2 Million Vehicle Delivery Target",Looking for stock market analysis and research with proves results? Zacks.com offers in-depth financial research with over 30years of proven results.
124742210,2023-12-28 11:45:02,n/a,"Dow Jones Futures Fall After Tesla Breaks Out, Apple Watch Scores Big Win",The market rally rose slightly Wednesday with Tesla clearing an entry and AAPL rebounding on an Apple Watch victory. Spotify is among leading stocks finding key support.
124748944,2023-12-28 11:04:00,n/a,The S&P 500’s 5 Most Mediocre Stocks of 2023,"Companies in the middle of the broad index logged gains of about 10%—a decent gain, except when compared with the index."
124748765,2023-12-28 10:38:00,n/a,"Tesla Could Start 2024 With A Bang: India Division, Manufacturing Facility Rumors Heat Up",Looking for stock market analysis and research with proves results? Zacks.com offers in-depth financial research with over 30years of proven results.
124742259,2023-12-28 10:21:00,n/a,"3 Artificial Intelligence (AI) Stocks With 48% to 123% Upside in 2024, According to Select Wall Street Analysts","Artificial intelligence (AI) can add $15.7 trillion to the global economy by 2030, and this opportunity isn't lost on Wall Street or its analysts."
124744310,2023-12-28 10:19:51,n/a,Tesla's Uphill Battle In China: Navigating The 2024 EV Market Amidst Rising Competition,Tesla faces a challenging position in the highly competitive Chinese EV market. Read more to see an overview and analysis of TSLA stock.
124751091,2023-12-28 10:00:00,n/a,Solana leads way as most big cryptocurrencies post declines,"Most large cryptocurrencies were down during morning trading on Thursday, with Solana seeing the biggest move, shedding 9.13% to $99.10. Six additional..."
124746210,2023-12-28 09:57:00,n/a,"Market Clubhouse Morning Memo - December 28th, 2023 (Trade Strategy For SPY, QQQ, AAPL, MSFT, GOOGL, META, TSLA, And NVDA)",Looking for stock market analysis and research with proves results? Zacks.com offers in-depth financial research with over 30years of proven results.
124742214,2023-12-28 09:41:21,n/a,Trending tickers: Bitcoin | Oil | Tesla | Apple,"Crypto stocks, Tesla and Apple were among gainers on Thursday, as we head towards the year's market close."
124748768,2023-12-28 09:01:00,n/a,"Tesla, Twitter, SpaceX Or Dogecoin: Which Musk-Associated Asset Saw Highest Value Growth In 2023?",Looking for stock market analysis and research with proves results? Zacks.com offers in-depth financial research with over 30years of proven results.
124742262,2023-12-28 09:00:00,n/a,"Nvidia, Tesla, and More: These 5 Stocks in the S&P 500 Are Having a Stellar 2023","The stock market is set to end the year on a high note, but people holding certain stocks may be happier than the rest of us."
124748769,2023-12-28 08:55:00,n/a,Senators call on Tesla to recall components known to pose risk to consumers,Looking for stock market analysis and research with proves results? Zacks.com offers in-depth financial research with over 30years of proven results.
124753092,2023-12-28 08:46:00,n/a,Tesla Beware. China’s Xiaomi Takes Aim With Its First EV.,"The Chinese company most famous for its smartphones, unveiled its first car on Thursday."
124746213,2023-12-28 08:43:00,n/a,"The best-performing stock of the year rose nearly 2,000%, while the second best averted disaster to log a tenfold gain in a wild 2023",Looking for stock market analysis and research with proves results? Zacks.com offers in-depth financial research with over 30years of proven results.
124748771,2023-12-28 08:32:00,n/a,"Tesla (TSLA) Stock Pops on Model Y Revamp, India Factory Speculation",Looking for stock market analysis and research with proves results? Zacks.com offers in-depth financial research with over 30years of proven results.
124746214,2023-12-28 07:55:00,n/a,Notable open interest changes for December 28th,Looking for stock market analysis and research with proves results? Zacks.com offers in-depth financial research with over 30years of proven results.
124742400,2023-12-28 07:22:57,n/a,EV maker VinFast launches first dealership in the US,"Vietnamese electric vehicle maker VinFast has launched its first partnershipwith a U.S.-based dealer, North Carolina-based Leith AutomotiveGroup, its latest effort to ramp up sales in the United..."
124746216,2023-12-28 07:06:00,n/a,"4 of the Magnificent Seven stocks are losing their mojo, and the entire group could stall out in 2024",Looking for stock market analysis and research with proves results? Zacks.com offers in-depth financial research with over 30years of proven results.
124746217,2023-12-28 07:03:00,n/a,"The best-performing stock of the year rose nearly tenfold, while the second best averted disaster to surge 1,000% in a wild 2023",Looking for stock market analysis and research with proves results? Zacks.com offers in-depth financial research with over 30years of proven results.
124745839,2023-12-28 07:02:00,n/a,"2024 Market Predictions: 2 Trends Destined to Crash, One Set to Soar",Looking for stock market analysis and research with proves results? Zacks.com offers in-depth financial research with over 30years of proven results.
124752976,2023-12-28 06:48:00,n/a,Tesla’s stock rallies toward a 3-month high as it heads for its 3rd-best year on record despite analyst concerns,"Shares of Tesla Inc. climbed 1.2% in premarket trading Thursday, putting them on track for a three-month high. The electric vehicle giant’s stock has..."
124748415,2023-12-28 06:47:00,n/a,Tesla Bull Ross Gerber Spars With Bear Gordon Johnson About Future Of EV Giant — And BYD's Entry Into America,Looking for stock market analysis and research with proves results? Zacks.com offers in-depth financial research with over 30years of proven results.
124746220,2023-12-28 06:30:00,n/a,S&P 500 Nears Record Territory Even As Momentum Slows: Why This Analyst Says Investors May Need To 'Proceed With Caution',Looking for stock market analysis and research with proves results? Zacks.com offers in-depth financial research with over 30years of proven results.
124748778,2023-12-28 05:57:00,n/a,Tesla Gets New Competition,Looking for stock market analysis and research with proves results? Zacks.com offers in-depth financial research with over 30years of proven results.
124748780,2023-12-28 05:54:00,n/a,"Elon Musk slams media reports of robot 'attack' in Tesla Texas factory, BI says",Looking for stock market analysis and research with proves results? Zacks.com offers in-depth financial research with over 30years of proven results.
124746405,2023-12-28 05:50:00,n/a,"NYT Vs. OpenAI: 'SPAC King' Palihapitya Warns Of 'Difficult Time' For LLMs, Munster Predicts Supreme Court Showdown",Looking for stock market analysis and research with proves results? Zacks.com offers in-depth financial research with over 30years of proven results.
124745270,2023-12-28 05:44:00,n/a,"Here’s a ‘solid contrarian idea’ for 2024, according to BTIG’s Krinsky",Looking for stock market analysis and research with proves results? Zacks.com offers in-depth financial research with over 30years of proven results.
124748522,2023-12-28 05:38:00,n/a,"Chinese smartphone maker Xiaomi aiming high as it enters EV race, Reuters says",Looking for stock market analysis and research with proves results? Zacks.com offers in-depth financial research with over 30years of proven results.
124748786,2023-12-28 05:18:00,n/a,Tesla Stock Investors Can Expect a Roller Coaster of Excitement and Drama in 2024,Looking for stock market analysis and research with proves results? Zacks.com offers in-depth financial research with over 30years of proven results.
124746225,2023-12-28 05:01:00,n/a,Tesla Forecast: Why 2024 Will Be Decisive for TSLA Stock,Looking for stock market analysis and research with proves results? Zacks.com offers in-depth financial research with over 30years of proven results.
124748788,2023-12-28 03:51:00,n/a,'Wrong Frame Of Reference:' Elon Musk Rebuts Tesla Bear For Saying EV Stock Is 'Egregiously Overvalued' Through Toyota Lens,Looking for stock market analysis and research with proves results? Zacks.com offers in-depth financial research with over 30years of proven results.
124748416,2023-12-28 03:06:00,n/a,"Chinese Smartphone Giant Xiaomi Enters Electric Vehicle Market, Targets Tesla, Porsche With SU7",Looking for stock market analysis and research with proves results? Zacks.com offers in-depth financial research with over 30years of proven results.
124748790,2023-12-28 02:03:00,n/a,Tesla CEO Elon Musk Slams Report Of Robot 'Attacking' Employee At Giga Texas: 'Truly Shameful',Looking for stock market analysis and research with proves results? Zacks.com offers in-depth financial research with over 30years of proven results.
124735918,2023-12-28 01:39:02,n/a,"Dow Jones Futures Rise After Tesla Breaks Out, Apple Watch Scores Big Win",The market rally rose slightly Wednesday with Tesla clearing an entry and AAPL rebounding on an Apple Watch victory. Spotify is among leading stocks finding key support.
124736134,2023-12-28 01:33:49,n/a,15 Best Stocks to Buy in 2024 According to Billionaire D.E. Shaw,"In this article, we looked at D.E. Shaw’s investment philosophy and returns. We also reviewed D.E. Shaw’s 15 best stocks to buy in 2024. You can skip our detailed discussion of D.E. Shaw and go straight to 5 Best Stocks to Buy in 2024 According to Billionaire D.E. Shaw. D.E. Shaw’s multi-strategy hedge fund, known […]"
124748791,2023-12-28 01:14:00,n/a,"Forget The Magnificent 7: Did Anyone Back These 1,000% Gainers In 2023?",Looking for stock market analysis and research with proves results? Zacks.com offers in-depth financial research with over 30years of proven results.
124736289,2023-12-28 01:00:12,n/a,13 Most Profitable Robinhood Stocks,"In this article, we discuss the 13 most profitable Robinhood stocks. If you want to read about some more Robinhood stocks, go directly to 5 Most Profitable Robinhood Stocks. The stock picking habits of retail investors who use platforms like Reddit to strategize and stock trading applications like Robinhood Markets, Inc. (NASDAQ:HOOD) to carry out […]"
124737190,2023-12-27 22:45:21,n/a,Tesla (TSLA) Exceeds Market Returns: Some Facts to Consider,"Tesla (TSLA) reachead $261.47 at the closing of the latest trading day, reflecting a +1.89% change compared to its last close."
124737191,2023-12-27 22:30:56,n/a,Tesla planning to roll out updated Model Y from China plant: report,Tesla is reportedly planning to produce an updated version of its popular Model Y SUV and is prepping its factory in Shanghai.
124737192,2023-12-27 22:14:29,n/a,Morgan Stanley eyes Tesla's non-EV potentials in new note,"Morgan Stanley analyst Adam Jonas is telling investors to ""expect another challenging year for the auto business"" in a new note on Tesla (TSLA) and its non-auto staples, including the EV maker's ventures into robotics and AI, that could push the stock higher against margin pressures. Jones' team reiterated the ""Overweight"" rating and $380 price target per share it has on Tesla's stock. Yahoo Finance Autos Correspondent Pras Subramanian breaks down Jonas' note and the outlooks for Tesla and the automotive industry in 2024. For more expert insight and the latest market action, click here to watch this full episode of Yahoo Finance Live."
124734334,2023-12-27 22:07:00,n/a,"These Stocks Moved the Most Today: Tesla, Apple, Coinbase, MicroStrategy, Iovance, NetEase, and More","A report says Tesla plans a revamped version of the Model Y from its Shanghai plant, while Apple shares are on pace to fall for a fifth-straight session."
124732748,2023-12-27 21:53:05,n/a,S&P 500 Gains and Losses: An Update to the Model Y Sends Tesla Shares Higher,"U.S. equities made small gains, with the S&P 500 up 0.1%, as the market continued to be fueled by optimism about possible Federal Reserve rate cuts in 2024."
124731120,2023-12-27 21:45:42,n/a,"Tesla to revamp Model Y, crypto stocks pop: Trending tickers","Tesla (TSLA) is set to revamp its Model Y at its Shanghai factory, according to a report from Bloomberg. There are also a few Wall Street analysts weighing in on the stock on Wednesday too, with Wedbush Securities' Dan Ives saying the EV maker's deliveries appear to be ""tracking slightly ahead"" of targets for the fourth quarter. Meanwhile, Adam Jonas of Morgan Stanley argues that Tesla is both an auto company and an AI company, though he expects 2024 to be a ""challenging"" one for the company's auto business. Coinbase (COIN), Marathon Digital (MARA), and Microstrategy (MSTR) are trading higher on Wednesday, with the crypto industry expecting the Securities and Exchange Commission to approve a spot bitcoin ETF in January. Yahoo Finance’s Julie Hyman and Josh Lipton deep dive into these trending tickers. For more expert insight and the latest market action, click here to watch this full episode of Yahoo Finance Live."
124730332,2023-12-27 21:05:21,n/a,Tesla Stock Clears Early Entry On Reported Plans To Refresh Its Most Popular Model For China In 2024,"Tesla appears to be working on a new and improved version of its most popular offering, the Model Y, at its factory in China with plans for mass production by mid-2024.  TSLA shares edged higher Wednesday.  The global EV giant is readying to unveil an updated Model Y in China, Bloomberg reported late Tuesday."
124737197,2023-12-27 20:53:45,n/a,A Tesla factory robot reportedly attacked a worker and left them bleeding. This could become a new reality in the increasingly automated workplace,"At least 41 workers have died in robot-related incidents, and some researchers fear it could get worse as factories automate."
124737198,2023-12-27 20:53:00,n/a,"Cathie Wood criticizes Ford, GM shareholders for 'short-term' thinking","Cathie Wood's Ark Invest believes in disruptive innovation. Ford and GM, she said, are missing out."
124728065,2023-12-27 19:47:44,n/a,"Toyota Is Poised To Keep Its Automotive Crown, But BYD Is Poised To Takeover Tesla's EV Throne","Global vehicle production reached all-time high last month. According to Bloomberg, Toyota Motor (NYSE: TM) is poised to keep its title as world’s best-selling automaker, beating Volkswagen AG (OTC: VWAGY) for the fourth consecutive year. As for the EV front, Bloomberg estimates that BYD Company Limited (OTC: BYDDY) is on track to dethrone Tesla Inc (NASDAQ: TSLA) and become the world’s leading EV seller. Toyota Seems Set To Keep Its Title Steady demand across North America and Europe helped Toy"
124728641,2023-12-27 19:40:00,n/a,"Tesla Stock Has 3 Drivers in 2024, According to Its Biggest Bull",Morgan Stanley analyst Adam Jonas sees shares of the maker of electric vehicles headed higher in 2024 after quite a run in 2023.
124728642,2023-12-27 19:00:00,n/a,"Rebel's Edge - December 27: $TSLA, $AAPL, and the NBA Shocker","Jon and Pete Najarian join forces to discuss and debate their favorite topics, including the hottest stock-specific news and sports!"
124727459,2023-12-27 18:33:54,n/a,25 Most In Demand Cars Heading into 2024,"In this article, we will be looking at the 25 most in-demand cars heading into 2024. We will be covering market trends, recent news, key players in the industry, and an overall market analysis of the automotive industry. If you want to skip our detailed analysis, you can go directly to the 5 Most In […]"
124723820,2023-12-27 16:15:00,n/a,"These Stocks Are Moving the Most Today: Tesla, Apple, Coinbase, Iovance, NetEase, Coherus BioSciences, and More","A report says Tesla plans a revamped version of the Model Y from its Shanghai plant, while Apple shares are on pace to fall for a fifth-straight session."
124728646,2023-12-27 17:36:59,n/a,Tesla Stock Clears Early Entry Amid Reports Of A New Model Y But Is TSLA A Buy Or A Sell?,Tesla stock performance in 2023 has been a big question as Elon Musk bets on the Cybertruck and autonomous driving.
124725711,2023-12-27 17:30:38,n/a,"Tesla plans a Model Y revamp at its Shanghai factory, according to reports","Rumors of a refreshed Tesla Model Y have been percolating for months, but electric vehicle buyers may finally have that option later next year."
124731574,2023-12-27 17:11:17,n/a,Two U.S. senators call for Tesla recalls after Reuters investigation,"Two U.S. senators have written toElon Musk, Tesla’s top executive, calling on him to “swiftly”recall any steering and suspension parts that pose a safetyrisk. The letter cites..."
124728650,2023-12-27 17:06:00,n/a,Tesla factory worker had a bloody encounter with Texas Gigafactory robot,"At one time, working at a Tesla  Gigafactory was seen as a step up from the normal automotive factory job.  A report from The Information shows just how dangerous the company's factory in Texas was for at least one worker who was ""attacked"" by a robot they were charged with programming.  A Tesla engineer was injured by a robot that pinned him to the wall with its claws in 2021, according to a witness report and an injury report obtained by The Information, digging into the worker's back and arm and leaving an open wound of their left hand."
124725061,2023-12-27 16:59:35,n/a,"Midday Movers: Tesla's Revamped Model Y, Streaming Services Down on Amazon Move",U.S. equities were little changed but higher at midday as the pre-Christmas rally that sent the markets soared eased.
124728654,2023-12-27 16:44:04,n/a,Tesla Reportedly Making Changes to Its Most Popular Model; Stock is Top S&P 500 Gainer,"Tesla is reportedly set to revamp its most popular vehicle, the Model Y, at its factory in Shanghai."
124728656,2023-12-27 16:43:00,n/a,Tesla just got beat out by another growing competitor,"Chinese automaker BYD said Wednesday that it has obtained the country's first conditional Level Three autonomous driving test license.  It is a step up from Level Two automation, which requires the hands-on, eyes-on attention of the driver; despite its name, Tesla's Full Self-Driving (FSD) remains stuck at this Level Two designation.  Robotaxis — which Tesla is working to design — would require Level Four of Level Five automation, which would not require human intervention."
124753098,2023-12-27 16:31:00,n/a,"Tesla Inc. stock rises Wednesday, outperforms market","Shares of Tesla Inc. advanced 1.88% to $261.44 Wednesday, on what proved to be an all-around great trading session for the stock market, with the NASDAQ..."
124728657,2023-12-27 15:40:21,n/a,Tesla Stock Near Buy Point On Reported Plans To Refresh Its Most Popular Model For China In 2024,"Tesla appears to be working on a new and improved version of its most popular offering, the Model Y, at its factory in China with plans for mass production by mid-2024.  TSLA shares edged higher early Wednesday.  The global EV giant is readying to unveil an updated Model Y in China, Bloomberg reported late Tuesday."
124728660,2023-12-27 15:28:00,n/a,General Motors' (GM) EVs to Get Ineligible for Tax Credits,"General Motors' (GM) Cadillac Lyriq & Chevrolet Blazer EVs are likely to temporarily lose the US EV tax credit, starting Jan 1, 2024."
124723620,2023-12-27 15:08:10,n/a,Tesla reportedly plans Model Y revamp at Shanghai factory,"Tesla (TSLA) is developing a revamped Model Y version to be produced at its Shanghai Gigafactory, slated to start production in mid-2024, according to a report from Bloomberg. The updated Model Y will feature new tech such as ambient lighting. Yahoo Finance's Pras Subramanian analyzes Tesla's product refresh as competition heats up in China, with domestic EV maker BYD (BYDDF) on pace to outsell Tesla for the first time ever this quarter. For more expert insight and the latest market action, click here to watch this full episode of Yahoo Finance Live."
124728328,2023-12-27 14:46:00,n/a,"The best-performing stock of the year rose nearly 10-fold, while the 2nd-best averted disaster to surge 1,000% in a wild 2023",Forget about the Magnificent Seven and AI. The stocks that did the absolute best during the year were tied to biotech and crypto — along with one car-related...
