id,datetime,impact,headline,summary
124797629,2024-01-01 20:35:20,n/a,"UPDATE 1-More EVs lose US tax credits including Tesla, Nissan, GM vehicles","Many electric vehicles lost eligibility for tax credits of up to $7,500 after new battery sourcing rules took effect on Monday, including the Nissan Leaf, Tesla Cybertruck All-Wheel Drive, some Tesla Model 3s and Chevrolet Blazer EV, the U.S. Treasury said.  The Treasury issued guidelines in December detailing new battery sourcing requirements aimed at weaning the U.S. electric vehicle supply chain away from China."
124800305,2024-01-01 20:00:00,n/a,Chinese Carmakers Launch Sodium-Ion Battery-Powered EVs,"Chinese carmakers, including Volkswagen-backed JAC Group, have launched electric vehicles powered by sodium-ion batteries, offering a cheaper and abundant alternative to traditional lithium-ion batteries."
124800306,2024-01-01 19:32:00,n/a,"1 Top Artificial Intelligence (AI) Stock to Buy Before It Soars 46%, According to This Wall Street Analyst",Morgan Stanley's Adam Jonas believes artificial intelligence could add $400 billion to Tesla's market cap.
124799487,2024-01-01 17:40:17,n/a,"More EVs lose US tax credits including Tesla, Nissan, GM vehicles","WASHINGTON (Reuters) -Many electric vehicles lost eligibility for tax credits of up to $7,500 after new battery sourcing rules took effect on Monday, including the Nissan Leaf, Tesla Cybertruck All-Wheel Drive, some Tesla Model 3s and Chevrolet Blazer EV, the U.S. Treasury said.  The Treasury issued guidelines in December detailing new battery sourcing requirements aimed at weaning the U.S. electric vehicle supply chain away from China.  The number of EV models qualifying for U.S. EV tax credits fell from 43 to 19."
124796586,2024-01-01 17:36:35,n/a,"More EVs lose US tax credits including Tesla Cybertruck, Nissan Leaf","Many electric vehicles lost eligibility for tax credits of up to $7,500 after new battery sourcing rules took effect on Monday, including the Nissan Leaf, Tesla Cybertruck All-Wheel Drive and Chevrolet Blazer EV, the U.S. Treasury said.  The Treasury issued guidelines in December detailing new battery sourcing requirements aimed at weaning the U.S. electric vehicle supply chain away from China.  The number of EV models qualifying for U.S. EV tax credits fell from 43 to 19."
124794368,2024-01-01 14:20:00,n/a,History Says the Nasdaq Will Surge in 2024: 2 Stock-Split Stocks to Buy Before It Does,These investor-favorite stocks faced challenges over the past couple of years but appear to have turned the corner.
124794370,2024-01-01 13:55:05,n/a,Stock Market Rally Strong Into 2024: Nvidia Sets Up Again; Tesla Deliveries Due,"After big 2023 market gains, here's how to prepare for the new year. Nvidia is among several leaders setting up again. Tesla deliveries are due with rivals already reporting."
124794371,2024-01-01 13:54:11,n/a,"Tesla Rival BYD Seizes Electric Vehicle Crown; China's Li Auto, XPeng Set Records","BYD's 2023 sales topped 3 million, with the Tesla rival's Q4 fully electric vehicle sales well above 500,000. China's Li Auto and Xpeng deliveries hits record highs too."
124794139,2024-01-01 13:21:00,n/a,"Investing Preview 2024: Buy These 4 ""Magnificent Seven"" Stocks. Avoid the Others.","The ""Magnificent Seven"" stocks have varying valuations. Four have room to run, and three have gotten too rich."
124794142,2024-01-01 12:30:00,n/a,"Which ""Magnificent Seven"" Stocks Are Screaming Buys Right Now?",Only three of the seven make the cut as buys at current levels.
124797461,2024-01-01 12:11:00,n/a,The 3 Hottest EV Stocks to Watch in 2024,Looking for stock market analysis and research with proves results? Zacks.com offers in-depth financial research with over 30years of proven results.
124795847,2024-01-01 11:40:00,n/a,10 Consumer Discretionary Stocks With Whale Alerts In Today's Session,Looking for stock market analysis and research with proves results? Zacks.com offers in-depth financial research with over 30years of proven results.
124793643,2024-01-01 11:30:00,n/a,Bull Market Buys: 2 Nasdaq Stocks to Own for the Long Run,Discover why Coinbase and Tesla stand out as top growth stocks deserving of a long-term investment.
124799382,2024-01-01 11:19:21,n/a,BYD Posts Record Sales Quarter to Challenge Tesla at Own EV Game,"(Bloomberg) -- Chinese automaker BYD Co. sold 526,409 fully electric vehicles in the fourth quarter, meaning Tesla Inc. will need a record showing to maintain its No. 1 status when it unveils sales figures on Tuesday.Most Read from BloombergQuake Hits Northwestern Japan, Killing Four, Wrecking HomesIran Sends Warship to Red Sea After US Sinks Houthi BoatsIndia’s Crude Oil Imports From Russia Plunge on Payment IssuesMaersk Halts Red Sea Shipping as US Navy Sinks Houthi BoatsPutin Says He Wants Pe"
124793644,2024-01-01 10:06:00,n/a,10 Stock Market Predictions for 2024,"Here's what to expect from the stock market, the U.S. economy, and some of the most widely held companies in the new year."
124797463,2024-01-01 10:04:00,n/a,Exploring The Competitive Space: Tesla Versus Industry Peers In Automobiles,Looking for stock market analysis and research with proves results? Zacks.com offers in-depth financial research with over 30years of proven results.
124794931,2024-01-01 09:54:00,n/a,"Consumer Discretionary outperforms S&P 500 in 2023; Royal Caribbean, TSLA among winners",Looking for stock market analysis and research with proves results? Zacks.com offers in-depth financial research with over 30years of proven results.
124794062,2024-01-01 08:30:00,n/a,Top 5 Stocks To Consider Avoiding As We Begin 2024,"S&P 500 outperformed Wall Street strategists' bearish prognostications, finishing the year up 25%. Find out top 5 stocks to avoid buying at current levels."
124794916,2024-01-01 08:08:00,n/a,BYD Leads Charge As Most Chinese EV Startups Clock Record December Deliveries: Warren Buffett-Backed Company On Track To Wrest Global EV Crown From Tesla,Looking for stock market analysis and research with proves results? Zacks.com offers in-depth financial research with over 30years of proven results.
124793912,2024-01-01 08:00:02,n/a,Reflections On 2023: Blended 98.4% Total Return,"2023 was an amazing year for stock pickers, with an impressive 98.4% return on two portfolios. Click here to find out what did and didn't work in 2023."
124794932,2024-01-01 07:59:00,n/a,2024’s Power Players: 7 Stocks Racing to a Trillion Valuation,Looking for stock market analysis and research with proves results? Zacks.com offers in-depth financial research with over 30years of proven results.
124793602,2024-01-01 07:00:00,n/a,7 Investments To Avoid In 2024,"Some picks might be contrarian, some might be bold, and some might sound crazy. Click here to find out my views on where not to invest in 2024."
124797469,2024-01-01 06:20:00,n/a,Top Picks 2024: BYD Co. Ltd.,Looking for stock market analysis and research with proves results? Zacks.com offers in-depth financial research with over 30years of proven results.
124794922,2024-01-01 06:14:00,n/a,EV Game Changers: 7 Stocks Fueling the Green Energy Movement,Looking for stock market analysis and research with proves results? Zacks.com offers in-depth financial research with over 30years of proven results.
124791968,2024-01-01 05:06:00,n/a,Western Anxiety About Chinese EVs Could Prove Self-Defeating,The U.S. and Europe risk slowing electric-vehicle adoption by excluding Chinese suppliers from subsidies and raising tariffs.
124797472,2024-01-01 02:09:00,n/a,Tesla Extends Subsidies In China By 1 Month As EV Maker Prepares To Report Q4 Deliveries,Looking for stock market analysis and research with proves results? Zacks.com offers in-depth financial research with over 30years of proven results.
124797473,2024-01-01 02:04:00,n/a,2024 electric vehicle jolt - fewer models qualify for the full tax credit,Looking for stock market analysis and research with proves results? Zacks.com offers in-depth financial research with over 30years of proven results.
124791152,2023-12-31 22:02:44,n/a,Cathie Wood warns GM and Ford electric vehicles slowdown is a mistake—one that will help Tesla and Elon Musk,"GM and Ford need to scale their EV operations to make them profitable, she said. Tesla will benefit if they don't."
124790237,2023-12-31 16:00:59,n/a,The year America's EV dreams met reality,"2023 was supposed to be a big year for EV transformation in the US, but the process of converting the nation’s vehicles to electric power proved to be a much longer one."
124786241,2023-12-31 12:00:00,n/a,‘They have this kind of incredible power’: Almost 75% of S&P 500 stocks under-performed in 2023 — but here are 3 ‘magnificent’ companies that bucked the trend and beat the market,Jim Cramer's 'Magnificent Seven' stocks are benchmark-index superstars.
124786862,2023-12-31 10:00:00,n/a,This Was A Funny Two Years In The Stock And Treasury Markets,"The year 2023 was a huge year for stocks, after a terrible year for stocks. What did the huge movements in the stock market do?"
124787444,2023-12-31 08:37:00,n/a,"Elon Musk Is OK Going To Hell, Got To Stay Home From Church After Questioning Stories Of Moses, Jesus In Sunday School: Does Billionaire Believe In God?",Looking for stock market analysis and research with proves results? Zacks.com offers in-depth financial research with over 30years of proven results.
124786351,2023-12-31 08:08:17,n/a,Ranking The Magnificent 7 Stocks And An ETF That Owns Them All (FNGS),"The Magnificent 7, formerly known as FAANG, had a strong 2023."
124794908,2023-12-31 06:07:00,n/a,Well Beyond The Forecasts What’s in Store for 2024?,Looking for stock market analysis and research with proves results? Zacks.com offers in-depth financial research with over 30years of proven results.
124776447,2023-12-30 14:27:41,n/a,These are the largest publicly-traded companies in each US state,"Yahoo Finance compiled a list of the biggest publicly traded companies in each state and Washington, D.C. based on market cap."
124776449,2023-12-30 14:17:32,n/a,16 Most Volatile Stocks To Buy Now,"In this article, we discuss the 16 most volatile stocks to buy now. If you want to skip our detailed analysis of these stocks, go directly to 5 Most Volatile Stocks To Buy Now. The economy of the United States is deeply linked to the stock market of the country. Both the economy and the […]"
124782587,2023-12-30 13:28:00,n/a,Where Will Tesla Stock Be in 2024?,Tesla is arguably the most popular stock in the market right now.
124775797,2023-12-30 12:30:00,n/a,The State of Tech Investing,The money isn't flowing like it used to. What's a tech investor to do?
124787446,2023-12-30 11:36:00,n/a,Charted: Tesla’s Global Sales By Model And Year (2016–2023),Looking for stock market analysis and research with proves results? Zacks.com offers in-depth financial research with over 30years of proven results.
124781187,2023-12-30 11:28:00,n/a,"Benzinga Bulls And Bears: Tesla, Apple, Microsoft, Plug Power And Analyst Sees Precursor To Dogecoin Rally",Looking for stock market analysis and research with proves results? Zacks.com offers in-depth financial research with over 30years of proven results.
124776742,2023-12-30 09:44:00,n/a,"Tesla Stock: The ‘Golden Vision’ Is About to Play Out, Says Daniel Ives",Looking for stock market analysis and research with proves results? Zacks.com offers in-depth financial research with over 30years of proven results.
124776743,2023-12-30 09:30:00,n/a,"Tesla 'Is The Only Investable' EV Play, Says Analyst, As Electric Vehicle Industry Navigates A Tough 2023: Year In Review",Looking for stock market analysis and research with proves results? Zacks.com offers in-depth financial research with over 30years of proven results.
124775912,2023-12-30 08:00:00,n/a,Stocks To Watch: Economic Releases Headline First Week Of 2024,"Stay informed on upcoming market events with Seeking Alpha's Stocks to Watch newsletter. Get previews of IPOs, earnings reports, and more."
124776745,2023-12-30 04:57:00,n/a,A record share of S&P 500 stocks underperformed the index in 2023 as ‘weirdest bull market in decades’ marches on,Looking for stock market analysis and research with proves results? Zacks.com offers in-depth financial research with over 30years of proven results.
124773780,2023-12-29 23:49:05,n/a,Stock Market Rally Looks Strong Into 2024: Nvidia Sets Up After Monster Run; Tesla Deliveries Due,"After big 2023 market gains, here's how to prepare for the new year. Nvidia is among several leaders setting up again. Tesla and key rivals report deliveries."
124775655,2023-12-29 23:30:00,n/a,Tesla Stock Is Set for Long-Term Growth. It’s Much More Than a Car Company.,"RESEARCH REPORTS These reports, excerpted and edited by Barron’s, were issued recently by investment and research firms. The reports are a sampling of analysts’ thinking; they should not be considered the views or recommendations of Barron’s."
124775800,2023-12-29 22:38:32,n/a,Even Xiaomi Is Going After Tesla,"On Thursday, Xiaomi Corporation (OTC: XIACY) unveiled its first EV as it looks to compete with Porsche and even the EV king itself, Tesla Inc (NASDAQ: TSLA). The Chinese consumer electronics company said to have spent more than $1.4 billion to develop its first EV, Xiaomi SU7. Nio Is Going All In Into The Super-Premium EV Battle Earlier on Saturday, Nio (NYSE: NIO) unveiled its flagship executive sedan, the ET9. Priced at 800,000 yuan, Nio is set to begin deliveries during the first quarter of 2"
124773782,2023-12-29 22:10:55,n/a,"Tech, cruises, Abercrombie: Top 2023 stock performances","Tesla (TSLA), Nvidia (NVDA), and Apple (AAPL) — three of the Magnificent Seven tech stocks — have seen huge gains in 2023, riding the waves of various technology and AI trends. But the tech trade is not the only industry that has benefitted this past year. Yahoo Finance Live examines several other outperformers across industries, including cruise operators Royal Caribbean Cruises (RCL) and Carnival Corp. (CCL), and even retail chain Abercrombie & Fitch (ANF). Solar energy stocks disappointed in 2023 as significant players saw big annual losses. For more expert insight and the latest market action, click here to watch this full episode of Yahoo Finance Live."
124775802,2023-12-29 22:01:21,n/a,Elon Musk Tells Cathie Wood That Having Investors Helps Establish He's 'Not Delusional' And Explains Tesla May Have Created More Employee Millionaires Than Any Company In History,"In a Spaces conversation streamed on X on Dec. 21, Tesla Inc. and SpaceX CEO Elon Musk provided insights into his approach to funding startups and managing investors. Hosted by ARK Investment Management CEO Cathie Wood, the discussion revealed Musk's philosophy on the role of investors in business. Despite his capacity to independently fund startups, Musk emphasized the strategic value of involving outside shareholders. ""Each investor you add is an ally,"" he said. ""It's good to have more allies."
124768567,2023-12-29 19:01:08,n/a,"AI, taxes, real estate, healthcare: Best of 2023 theme weeks","From EVs and student loans, to retail and retirement, Yahoo Finance covered it all in 2023. As investors begin to look to what’s in store for the year ahead, our experts help set the stage. Here are some of the highlights from Yahoo Finance's theme weeks. Taxes (00:00:03) As part of the Yahoo Finance's Ultimate Tax Guide weekly series, Dan Geltrude, Geltrude & Company Founder, broke down some of the most important changes in the tax code for 2023. Geltrude said, ""Good news. The standard deductions are larger this year. The Child Tax Credit, a little bit smaller this year. Also, the expansion of the Child and Dependent Care Credit is expiring."" Real Estate (00:00:27) Shark Tank star and The Corcoran Group Founder Barbara Corcoran thinks that now is the absolute best time to buy a home. As part of Yahoo Finance's weekly series Real Estate: The New Reality, Corcoran said, ""I think it's the absolute best time to buy a home. There's nothing in my logic that says it makes sense to wait. You ought to jump in now and get the house while you can."" Retirement (00:00:39) Opportunity Knock$ Financial Coach Jean Chatzky believes that it is best to weigh one's income streams against their biggest expenses, including where you live, far ahead of retirement. As part of Yahoo Finance's weekly series Retirement Readiness: Planning Your Future, Chatzky said, ""The first thing that you have to do is figure out what your retirement looks like ... When are you retiring? Where are you retiring? What will you do day-to-day in your retirement?"" Retail (00:01:05) As part of Yahoo Finance's week-long series Retail Evolution: The New Era, Tanger Outlets (SKT) CEO Stephen Yalof discussed the uptick in outlet mall shopping and the new-found approachability of luxury brands. Yalof said, ""Outlet centers are value shopping experiences for people that are looking to buy brands at the best possible price. And in this environment right now, that's what the customer is looking for."" Student Loans (00:01:17) The Biden administration's Public Service Loan Relief program has saved borrowers billions of dollars. American Federation of Teachers President Randi Weingarten joined Yahoo Finance as part of the weekly series Student Loans: Smarter Strategies. Weingarten explained, ""The President is trying to put into place things that will help people who go to college. And we should be really helping people go to college, and doing it in an affordable way."" EVs (00:01:31) As part of Yahoo Finance's weekly series EVs: The Road Ahead, Blink Charging (BLNK) President and CEO Brendan Jones and Plug In America Executive Director Joel Levin discussed the most important challenges behind the EV charging infrastructure. Jones believes that consumers need to break the trend of fueling at a station rather than using reliable home chargers. He explained, ""We have to break the dominant paradigm of charging by saying, you don't have to go to a depot or fuel station. You can charge at work. You can charge at home."" Healthcare (00:01:41) Amazon (AMZN) has made a big push into the healthcare industry. Amazon Pharmacy Chief Medical Officer Dr. Vin Gupta joins Yahoo Finance as part of the weekly series Healthcare: Industry Checkup to describe how Amazon Pharmacy delivers prescriptions directly to customers' doors. Dr. Vin Gupta said, ""All these feature sets are really set to address the biggest problem in healthcare, which is patient information, patient awareness of services, of products that can actually result in lower costs to them for their prescription medications."" Top stories of 2023 (00:02:04) It has been quite the year for artificial intelligence. Yahoo Finance’s Dan Howley takes a look at the year AI has had as part of Yahoo Finance's Countdown: Top Stories of 2023. “To say that 2023 was the year of AI, would be the understatement of, well, the year,” Howley said. ""It started in November 2022 with the release of ChatGPT by OpenAI. The chatbot quickly became the fastest growing app in history, to that point,” hitting 100 million users in two months. In May 2023, Nvidia’s (NVDA) market value “briefly topped $1 trillion dollars for the first time, cementing its status as the AI chip leader.” Investor Guide (00:02:40) The Magnificent Seven didn't just dominate the markets this year, they also topped the list of the most trafficked ticker pages on Yahoo Finance. Tesla (TSLA), Nvidia, Apple (AAPL), Amazon, and Microsoft (MSFT) topped the ranking. Yahoo Finance's Jared Blikre broke down the list as part of the weekly series 2024 Investor Guide. ""Not surprisingly in a year that was all about the mega caps, the Mag Seven, they dominate the top ten most popular pages visited by you on the Yahoo Finance app and website,"" Blikre said. ""And the winner by far is Tesla ... that was seen over 300 million times this year."""
124769046,2023-12-29 18:00:11,n/a,"Tesla Rival BYD Set To Seize Electric Vehicle Crown; China's Li Auto, Nio, XPeng On Tap Too","China EV makers Li Auto, Nio and XPeng will report deliveries on Jan. 1. BYD should overtake Tesla in fully electric vehicles as of Q4."
124767275,2023-12-29 17:47:51,n/a,Can Magnificent 7 stocks sustain market dominance in 2024?,"The Magnificent Seven stocks — Apple (AAPL), Microsoft (MSFT), Alphabet (GOOG, GOOGL), Amazon (AMZN), Meta (META), Tesla (TSLA), and Nvidia (NVDA) — dominated the tech landscape in 2023, and Constellation Research Founder and Principal Analyst R ""Ray"" Wang believes they could ""definitely"" continue leading into 2024 after driving two-thirds of the S&P 500's (^GSPC) gains. Wang attributes their outperformance to AI, digital networks, and unmatched revenue growth. These core strengths with wide enterprise adoption position them to maintain index sway. Beyond the Magnificent Seven, Wang highlighted other names like Oracle (ORCL) and ServiceNow (NOW) also poised to ""benefit from the AI boom."" For more expert insight and the latest market action, click here to watch this full episode of Yahoo Finance Live."
124767740,2023-12-29 17:21:00,n/a,"Tesla Stock Today: A Bad Day, A Very Good Year","Tesla  stock has had a great year—but a lousy five months and change as it limps into the end of the year.  What most of the headlines left out was that the attack occurred in 2021, and was caused by a “Kuka robot arm (found in all factories),” Tesla CEO Elon Musk wrote on X, formerly known as Twitter."
124765774,2023-12-29 16:34:31,n/a,"AI, Magnificent 7 highlight biggest takeaways from 2023","2023 was a tumultuous year for the economy and the world at large. With ongoing and escalating geopolitical conflicts, a banking crisis, inflation, volatility, chaos in Congress, and more, there's a lot to sift through. Yahoo Finance anchors Brad Smith and Brian Sozzi take a look back at the year, their biggest takeaways, and dive deep into the concept of 'Hopeium,' driven by generative AI and the Magnificent Seven stocks.For more expert insight and the latest market action, click here to watch this full episode of Yahoo Finance Live."
124782774,2023-12-29 16:31:00,n/a,"Tesla Inc. stock falls Friday, underperforms market","Shares of Tesla Inc. slid 1.86% to $248.48 Friday, on what proved to be an all-around rough trading session for the stock market, with the NASDAQ Composite..."
124771709,2023-12-29 16:20:00,n/a,NEW YORK MARKET CLOSE: Top tech names dominate bumper year for stocks,Looking for stock market analysis and research with proves results? Zacks.com offers in-depth financial research with over 30years of proven results.
124769050,2023-12-29 16:07:04,n/a,"Tesla Deliveries, Jobs Report Kick Off 2024's First Investing Action Plan","Investing Action Plan: 2024 kicks off with Tesla deliveries, even as BYD seizes the EV crown. The December jobs report is due Friday."
124763207,2023-12-29 13:09:51,n/a,Magnificent Seven Stocks Had A Huge 2023. All Are In Prime Position Heading Into 2024.,The Magnificent Seven stocks had huge gains in 2023. All are in or near buy points heading into the new year.
124767743,2023-12-29 16:02:45,n/a,"Fisker makes strides, but may have a long road ahead","EV maker Fisker (FSR) has seen a recent surge in its share price amid plans to boost sales and deliveries in January. The company delivered more than 4,700 EVs in the final three months of 2023, up more than 300% from the third quarter, and it delivered its first Fisker Ocean Sport model. All might not be clear for Fisker, however, with ongoing production challenges and heavy competition in the industry, namely, Tesla (TSLA). Yahoo Finance's Brian Sozzi and Brad Smith report on this story and weigh in the cost and value of the company's stock."
124771433,2023-12-29 14:58:00,n/a,What should you expect for the stock market in 2024?,"Also: Gold, oil, stock picks and advice from the Moneyist."
124765019,2023-12-29 14:45:00,n/a,A Flashback of the Biggest Auto Sector Stories of 2023,"Let's look back at some of the most important automotive stories of 2023, including UAW-Detroit 3 standoff, Tesla's NACS wave and more, which grabbed the headlines."
124763977,2023-12-29 13:45:00,n/a,Forget Rivian: Buy These Magnificent EV Stocks Instead,Rivian's recent struggles make it a risky bet. Investors are better off focusing on these seasoned veterans instead.
124763997,2023-12-29 13:43:00,n/a,2024 Could Be a Breakout Year for VinFast. Is the Stock a Buy Now?,"VinFast is an intriguing EV opportunity with many factors going in its favor, but can it break into Western markets?"
124763209,2023-12-29 13:12:40,n/a,"3 Charts For Investors to Watch Friday: Alphabet, Tesla, Altice USA",These three stocks are worth watching today. We discuss why and identify important chart levels to monitor.
124762494,2023-12-29 12:52:55,n/a,"Dow Jones Futures: S&P 500 Near High; Tesla Below Buy Point, Hot IPO Hits Profit-Taking Zone",Tesla undercut an early entry while hot tech IPO Arm Holdings moved into a profit-taking zone heading into the final trading day of 2023.
124762493,2023-12-29 12:47:00,n/a,3 Things You Need to Know if You Buy ChargePoint Holdings Today,The EV charging network operator faces challenges as a new management team looks to turn things around.
124763326,2023-12-29 12:43:48,n/a,5 Things to Know Before The Stock Market Opens,Nvidia has announced the launch of a gaming chip with slower processing speeds in China to satisfy U.S. export rules. JD.com was higher after it won a lawsuit against Alibaba.
124762495,2023-12-29 12:02:00,n/a,"No, Tesla's Big Recall Isn't a Big Deal for the Stock",Here's what the recall of more than 2 million vehicles means -- and what it doesn't mean -- for investors.
