id,datetime,impact,headline,summary
124727221,2023-12-27 14:42:58,n/a,Magnificent Seven Loses Importance as Soft Landing Means Risk On,"(Bloomberg) -- The soft-landing scenario that investors see for next year points to further gains in US stocks. But it also dims the prospect of another stretch of wild outperformance for the technology giants that dominated in 2023.Most Read from BloombergThe Late-Night Email to Tim Cook That Set the Apple Watch Saga in MotionChinese Carmaker Overtakes Tesla as World’s Most Popular EV MakerTesla Plans Revamp of Smash Hit Model Y From China PlantApple’s iPhone Design Chief Enlisted by Jony Ive,"
124726811,2023-12-27 13:49:44,n/a,TSLY: Fundamentally Not A Tesla 'Income Strategy' But A Speculative Instrument,"YieldMax TSLA Option Income Strategy ETF, a Tesla-centered call option fund, has a high distribution rate of ~75%. Read what investors need to know."
124728329,2023-12-27 13:44:00,n/a,Spreads tighten on 'Magnificent Seven' corporate bonds as investors take profits,Bond prices narrow between 10-year Treasurys and all but two of the seven largest S&P 500 components.
124728667,2023-12-27 13:43:38,n/a,2 US senators call for Tesla recalls after investigation,"Two U.S. senators have written to Elon Musk, Tesla’s top executive, calling on him to “swiftly” recall any steering and suspension parts that pose a safety risk.  The letter cites “an alarming” Reuters investigation published on December 20 that exposed how Tesla has blamed drivers for frequent failures of components it has long known were defective.  “We write with extreme concern following recent reporting about Tesla’s knowledge of safety flaws in its vehicles and concealment of the causes of these flaws from the National Highway Traffic Safety Administration,” states the letter, which is signed by Senators Richard Blumenthal, of Connecticut, and Edward J. Markey, of Massachusetts."
124728669,2023-12-27 13:30:00,n/a,Can Tesla Stock Hit $300 in 2024?,"After a monster run-up in 2023, what can investors expect next year?"
124728671,2023-12-27 13:24:00,n/a,Tesla Robot Injures Worker—Report. Why Deliveries Matter More for the Stock.,"Tesla is heading into next year on a high note as its stock has more than doubled in 2023. Media reports of a robot injuring a worker at one of its factories aren’t putting off market analysts, who are more interested in the next delivery figures."
124726709,2023-12-27 12:46:00,n/a,Spreads tighten on ‘Magnificent Seven’ corporate bonds as investors take profits,Looking for stock market analysis and research with proves results? Zacks.com offers in-depth financial research with over 30years of proven results.
124726711,2023-12-27 12:41:00,n/a,Elon Musk Takes A Dig At BCG Ranking Tesla Behind Apple In Most Innovative Companies Of 2023 List: 'The Amazing Part Is...',Looking for stock market analysis and research with proves results? Zacks.com offers in-depth financial research with over 30years of proven results.
124725451,2023-12-27 12:27:46,n/a,My Top 3 EV Stocks For 2024,The market outlook for the EV segment of the automobile market is still very positive. Click here to read more about my top three EV stock picks for 2024.
124753101,2023-12-27 12:21:00,n/a,This Tesla bull expects another 'volatile' year for EV maker,"Tesla faces a ""volatile, idiosyncratic year"" with no new products and increased competition, Morgan Stanley says."
124726713,2023-12-27 12:21:00,n/a,"Biggest stock movers today: Tesla, crypto-related names, Cytokinetics, Masimo and more",Looking for stock market analysis and research with proves results? Zacks.com offers in-depth financial research with over 30years of proven results.
124726036,2023-12-27 12:05:00,n/a,Warren Buffett-Backed BYD Set To Topple Elon Musk's Tesla As World's No.1 EV Seller This Quarter,Looking for stock market analysis and research with proves results? Zacks.com offers in-depth financial research with over 30years of proven results.
124726719,2023-12-27 11:56:00,n/a,"Most Active Equity Options For Midday - Wednesday, Dec. 27",Looking for stock market analysis and research with proves results? Zacks.com offers in-depth financial research with over 30years of proven results.
124726723,2023-12-27 11:29:00,n/a,7 Electric Vehicle Stocks Worth Holding Until 2030,Looking for stock market analysis and research with proves results? Zacks.com offers in-depth financial research with over 30years of proven results.
