id,datetime,impact,headline,summary
124776747,2023-12-29 11:59:00,n/a,"Elon Musk Teases SpaceX 'Company Talk' Session Next Week, Plans Tesla Insights In Follow-Up",Looking for stock market analysis and research with proves results? Zacks.com offers in-depth financial research with over 30years of proven results.
124776749,2023-12-29 11:21:00,n/a,Cross-Border Champions: 3 Stocks Excelling in International Markets,Looking for stock market analysis and research with proves results? Zacks.com offers in-depth financial research with over 30years of proven results.
124761969,2023-12-29 11:19:00,n/a,Trending tickers: Anglo American | Tesla | JD | Lyft,The latest investor updates on stocks that are trending on the last trading day of 2023.
124762497,2023-12-29 11:00:25,n/a,"Elon Musk and these other 9 bosses had a terrible, horrible, no good, very bad 2023","For some top executives, 2023 is a year they would rather forget."
124766197,2023-12-29 10:58:00,n/a,What You Missed On Wall Street This Morning,Looking for stock market analysis and research with proves results? Zacks.com offers in-depth financial research with over 30years of proven results.
124768270,2023-12-29 10:55:00,n/a,These 20 stocks soared the most in 2023,The 2023 rally for stocks in the U.S. accelerated as more investors bought the idea that the Federal Reserve succeeded in its effort to bring inflation to...
124776751,2023-12-29 10:43:00,n/a,"Tesla Is Reportedly Considering Setting Up A Factory In Gujarat, India",Looking for stock market analysis and research with proves results? Zacks.com offers in-depth financial research with over 30years of proven results.
124771437,2023-12-29 10:35:00,n/a,Amazon’s stock looks to enter 2024 with a record-tying weekly winning streak,"Shares of Amazon climbed back into positive territory for the week on Thursday, putting them on track to end the year with a record-tying weekly winning streak."
124764280,2023-12-29 10:28:47,n/a,Tesla: The 2024 Tsunami,"Despite cutting prices and squeezing margins, Tesla still lost market share, at least in China. Read more to see an overview and analysis of TSLA stock."
124762498,2023-12-29 10:20:00,n/a,Here's the Best Way to Invest in 2024,"The stock market is likely to be volatile in 2024, and diligent investors will find opportunities."
124762499,2023-12-29 10:11:00,n/a,Tesla Stock Doubled in 2023. Here's Why It's Still a Buy Heading Into 2024.,Tesla's strategy to grow its lead in EV sales looks to be paying off.
124769280,2023-12-29 10:01:00,n/a,Most large cryptocurrencies increase as Solana  rallies,"Most large cryptocurrencies were up during morning trading on Friday, with Solana seeing the biggest change, climbing 8.92% to $109.30. Seven additional..."
124766410,2023-12-29 09:24:00,n/a,"Market Clubhouse Morning Memo - December 29th, 2023 (Trade Strategy For SPY, QQQ, AAPL, MSFT, TSLA, GOOGL, META, And NVDA)",Looking for stock market analysis and research with proves results? Zacks.com offers in-depth financial research with over 30years of proven results.
124764706,2023-12-29 09:13:00,n/a,27 Companies With IPOs in 2010: Best and Worst Performers,Looking for stock market analysis and research with proves results? Zacks.com offers in-depth financial research with over 30years of proven results.
124776756,2023-12-29 09:02:00,n/a,"CEO Elon Musk Reiterates Tesla Market Cap Could Surpass Apple, Saudi Aramco Combined In Next 5 Years: 'If...Executes Extremely Well'",Looking for stock market analysis and research with proves results? Zacks.com offers in-depth financial research with over 30years of proven results.
124763108,2023-12-29 08:45:00,n/a,"Tesla Stock At A Make-Or-Break Level: My Strategy For Buy, Sell, Or Hold","Tesla, Inc. stock has outperformed its big tech peers since late October 2023 due to its interest rate-sensitive business. Read why TSLA stock is a hold."
124776757,2023-12-29 08:27:00,n/a,"First Reported Cybertruck Crash: Toyota Corolla Sustains Injuries, Damage On Tesla Vehicle Unclear",Looking for stock market analysis and research with proves results? Zacks.com offers in-depth financial research with over 30years of proven results.
124765749,2023-12-29 07:55:00,n/a,Notable open interest changes for December 29th,Looking for stock market analysis and research with proves results? Zacks.com offers in-depth financial research with over 30years of proven results.
124771439,2023-12-29 07:47:00,n/a,"AI, the Fed, Bitcoin, and More Have Driven This Year’s Bull Rally. What to Expect in 2024.","Looking back on 2023 in the markets, we review what happened with the Fed, the Magnificent Seven stocks, crypto, gold and more. Plus, what might be coming in..."
124762187,2023-12-29 07:15:00,n/a,"Wall Street Breakfast Podcast: Goodbye 2023, Hello 2024",Happy last trading day of 2023! Google to settle $5B 'Incognito Mode' lawsuit and Cathie Wood switches Bitcoin ETFs.
124766418,2023-12-29 07:08:00,n/a,Tesla Investor Ross Gerber Worries CEO Musk's 'Extreme' Behavior Could Hit Sales And Drive Consumers To Other EVs: 'Can't Diminish Effect Of Damage That He Has Caused',Looking for stock market analysis and research with proves results? Zacks.com offers in-depth financial research with over 30years of proven results.
124771440,2023-12-29 06:55:00,n/a,"Rate-Cut Hopes, AI, No Recession This Year. Why Stocks Will Find 2024 Tougher.","Gasoline prices could fall to $3.38 a gallon in 2024, U.S. holiday air travel on pace to break records, and other news to start your day."
124764481,2023-12-29 06:54:00,n/a,"Tax-loss selling makes these stocks in cannabis, pharma, energy and industrials worth buying",Looking for stock market analysis and research with proves results? Zacks.com offers in-depth financial research with over 30years of proven results.
124765374,2023-12-29 06:49:00,n/a,"Nasdaq, S&P 500 Futures Flat Ahead Of 2023's Final Session As Broader Market Eyes Record Close: Analyst Says 'Sellers Already Done'",Looking for stock market analysis and research with proves results? Zacks.com offers in-depth financial research with over 30years of proven results.
124776763,2023-12-29 06:48:00,n/a,"California Highway Patrol confirms first Cybertruck accident, The Verge says",Looking for stock market analysis and research with proves results? Zacks.com offers in-depth financial research with over 30years of proven results.
124771435,2023-12-29 06:44:00,n/a,"Fisker's stock soars as EV maker to announce plan to boost sales, deliveries","Fisker's stock surged Friday, after the electric vehicle maker said it will announce in January a plan to accelerate sales and deliveries."
124776765,2023-12-29 06:02:00,n/a,Bernie Sanders Throws Weight Behind Nordic Workers' Unions As They Take On Elon Musk's Tesla: 'They Deserve Our Support',Looking for stock market analysis and research with proves results? Zacks.com offers in-depth financial research with over 30years of proven results.
124760733,2023-12-29 06:00:50,n/a,The most popular used cars of 2023,Ford topped the list across the first three quarters of the year.
124766421,2023-12-29 05:55:00,n/a,"Rivian CEO RJ Scaringe Positions R2 As Tesla Model 3 Challenger: 'Strategically, It's Very Similar'",Looking for stock market analysis and research with proves results? Zacks.com offers in-depth financial research with over 30years of proven results.
124765751,2023-12-29 05:52:00,n/a,"The stock market will hit a new peak but there are 4 reasons equities may feel the chill as early as February, says Tom Lee",Looking for stock market analysis and research with proves results? Zacks.com offers in-depth financial research with over 30years of proven results.
124765753,2023-12-29 05:32:00,n/a,"The stock market will hit a new peak but there are 4 reasons stocks may feel the chill as early as February, says Tom Lee",Looking for stock market analysis and research with proves results? Zacks.com offers in-depth financial research with over 30years of proven results.
124766371,2023-12-29 05:32:00,n/a,Good News! Why Top China EV Play Li Auto Is Just Getting Started.,Looking for stock market analysis and research with proves results? Zacks.com offers in-depth financial research with over 30years of proven results.
124765377,2023-12-29 05:06:00,n/a,"2023's Top Dogs: Nvidia, Meta Lead S&P 500 Charge In Tumultuous Year — But Which 'Magnificent Seven' Stock Will Be 2024's Runaway Winner?",Looking for stock market analysis and research with proves results? Zacks.com offers in-depth financial research with over 30years of proven results.
124768354,2023-12-29 04:53:00,n/a,Tesla (NASDAQ:TSLA) Eyes Gujarat for First Plant in India,Looking for stock market analysis and research with proves results? Zacks.com offers in-depth financial research with over 30years of proven results.
124776772,2023-12-29 04:25:00,n/a,5 Best-Performing Single-Stock ETFs Of 2023,Looking for stock market analysis and research with proves results? Zacks.com offers in-depth financial research with over 30years of proven results.
124757198,2023-12-29 02:19:55,n/a,Dow Jones Futures Rise: Tesla Falls Below Buy Point; Hot IPO Hits Profit-Taking Zone,Tesla undercut an early entry while hot tech IPO Arm Holdings moved into a profit-taking zone heading into the final trading day of 2023.
124766424,2023-12-29 03:37:00,n/a,'All Roads Lead To AGI:' Elon Musk Says Tesla Building 'Extremely Compute-Efficient' Mini Intelligence System For FSD,Looking for stock market analysis and research with proves results? Zacks.com offers in-depth financial research with over 30years of proven results.
124771214,2023-12-29 03:27:00,n/a,What You Missed On Wall Street On Friday,Looking for stock market analysis and research with proves results? Zacks.com offers in-depth financial research with over 30years of proven results.
124766832,2023-12-29 03:15:00,n/a,"Legendary Investor Jim Rogers Predicts Market Bubble, Positions To Short Tesla, Apple And Other 'Magnificent Seven'",Looking for stock market analysis and research with proves results? Zacks.com offers in-depth financial research with over 30years of proven results.
124776777,2023-12-29 03:06:00,n/a,"AI Revolution, Fed's Pivot Power US Stock Market To A Record Year: This Week In Markets",Looking for stock market analysis and research with proves results? Zacks.com offers in-depth financial research with over 30years of proven results.
124776778,2023-12-29 03:04:00,n/a,Elon Musk’s Tesla likely to set up its first India manufacturing plant in Gujarat,Looking for stock market analysis and research with proves results? Zacks.com offers in-depth financial research with over 30years of proven results.
124776779,2023-12-29 02:50:00,n/a,"Notable Friday Option Activity: TSLA, PLL, GPS",Looking for stock market analysis and research with proves results? Zacks.com offers in-depth financial research with over 30years of proven results.
124776781,2023-12-29 02:06:00,n/a,SpaceX Share Frenzy: Investors Must Beware Of Scams Offering Shares In $180 Billion Company,Looking for stock market analysis and research with proves results? Zacks.com offers in-depth financial research with over 30years of proven results.
124769093,2023-12-29 02:05:00,n/a,"Catalyst Watch: Macau gaming numbers,  jobs report, Walgreens results",Looking for stock market analysis and research with proves results? Zacks.com offers in-depth financial research with over 30years of proven results.
124768979,2023-12-29 01:58:00,n/a,Wall Street Says These 3 Magnificent 7 Stocks Will Crash in 2024,Looking for stock market analysis and research with proves results? Zacks.com offers in-depth financial research with over 30years of proven results.
124770726,2023-12-29 01:41:00,n/a,"The 500 Top Stocks to Buy for 2024, Ranked by AI",Looking for stock market analysis and research with proves results? Zacks.com offers in-depth financial research with over 30years of proven results.
124766426,2023-12-29 01:18:00,n/a,"No Threat From Traditional Autos, But Tesla Should Be Concerned About Chinese Rivals And This FAANG Giant: Munster",Looking for stock market analysis and research with proves results? Zacks.com offers in-depth financial research with over 30years of proven results.
124757917,2023-12-29 01:00:52,n/a,Inside Nio: Electric car group’s boss William Li and his fight for survival,Chinese EV company is still missing production targets and racking up big losses a decade after its launch
124753873,2023-12-28 22:02:05,n/a,"How the EV market will be shaped in US, China in 2024","US consumer demand for electric vehicles has started to wane as economic headwinds and inflation pick up, reducing affordability options. As inflation seems to cool and new competitors join the EV space, is there a possibility things could pick up in 2024? Bill Newman, Industry Executive Advisor at SAP North America, joins Yahoo Finance Live with Autos Reporter Pras Subramanian to discuss the state of the EV market, domestically and in China heading into 2024. Newman gives context to China's ability to expand with its existing electrical grid system and also explains competition entering the US. ""I think that you're also seeing some not just in China, but you're seeing some of the Asia Pacific companies — VinFast (VFS) is one — take advantage of some of the IRA funding and some of the Infrastructure Bill opportunities available to help offset some of their expansion in the world's largest market right here in the US and North America,"" Newman says. ""Two very different markets, two very different energy frameworks, and two very different industrial policies."" For more expert insight and the latest market action, click here to watch this full episode of Yahoo Finance Live."
124752076,2023-12-28 21:46:55,n/a,Dow Jones Futures: Tesla Falls Below Buy Point; Hot IPO Hits Profit-Taking Zone,Tesla undercut an early entry while hot tech IPO Arm Holdings moved into a profit-taking zone heading into the final trading day of 2023.
124752077,2023-12-28 21:37:53,n/a,S&P 500 Gains and Losses Today: Match Group Jumps Amid Optimistic Growth Outlook,"The S&P 500 gained less than 0.1% on Thursday, Dec. 28, 2023, eking out a small advance after oscillating just beneath its all-time high."
124752078,2023-12-28 21:17:04,n/a,"Cathie Wood, Meredith Whitney and more: C-Suite Insights","Yahoo Finance sat down with top leaders across different industries to discuss topics including the IPO market in 2024, luxury automobiles, and the housing market in the United States. Ark Invest (ARKK) Founder, CEO, and CIO Cathie Wood discusses the IPO market in 2024, Tesla, and a spot bitcoin ETF. ""Now what we're seeing is we're diversifying once again. We're adding back... some stocks that we've sold... we're looking forward to the IPO window opening again,"" Wood says, especially in AI, as well as other innovation spaces. On Tesla (TSLA), Wood says, ""we do believe that Tesla is in the pole position to be the autonomous taxi platform in the United States."" Wood adds, ""the outlook is bright for a... spot bitcoin ETF and we do think it will be in January."" Automobili Pininfarina (PINF.MI) CEO Paolo Dellachà notes the ""key elements"" of being in ""the luxury segment"" as an ultra-luxury auto designer. ""To stay in the luxury segment, is definitely a lot about technology, about performance. But still the key elements of Battista and everything Pininfarina... will also develop in the future, start and originates from the vision about the design,"" Dellachà explains. ""For us, it was about embracing the future and also embracing the technology that not only allow us to have a car which is emission-free, is also allowing the car to have the highest level of performance that you can now achieve today. And this comes with electric."" Meredith Whitney LLC Founder Meredith Whitney explains the ""silver tsunami"" in the housing market in the U.S. ""The U.S. economy is remapping itself regionally,"" Whitney says, ""you see population migration going along the lines of economic opportunity and economic growth."" ""The other major demographic trend you see, is the aging of America... the 'silver tsunami' is 10,000 people a day turning 65 and by 2030, the entire baby boomer... generation will be over 65."" Whitney explains that ""AARP estimates that 51 percent of people over 50 downsized their home and people over 50 are 74 percent of total U.S. homeowners. So if you just take... half of that you've got about 30 million homes that should be coming on the market."" Key video moments: 00:00:05 - Ark Invest CEO Cathie Wood 00:00:46 - Automobili Pininfarina CEO Paolo Dellachà 00:01:32 - Meredith Whitney LLC Founder Meredith Whitney"
124752080,2023-12-28 21:05:04,n/a,Tesla Stock Rally Falters Amid Reports Of Imminent India Factory Announcement,"Tesla appears to be moving closer to officially unveiling its long rumored India manufacturing plant, with local reports Thursday expecting the announcement to come early in 2024.  TSLA shares advanced early before falling, reducing their December rally.  The global EV giant is expected establish its latest factory in Gujarat, situated on the western coast of India, with the official unveiling taking place during the ""Vibrant Gujarat Summit"" in January, local media reported Thursday."
124755077,2023-12-28 19:28:29,n/a,FQAL: Not The Most Attractive Quality ETF,"FidelityÂ® Quality Factor ETF emphasizes quality characteristics, yet has underperformed competitors and the S&P 500 index since inception. Click for more on FQAL."
124752081,2023-12-28 18:46:17,n/a,Tesla's EV Business Faces 'Challenges' In 2024. That Might Not Stop TSLA Stock.,Price cuts slashed profits in 2023 with the core Tesla EV business facing a challenging 2024. But that isn't deterring Tesla stock bulls.
124752663,2023-12-28 17:18:02,n/a,3 Things To Do After The S&P 500 Gained Nearly 25% In 2023,"Investors should look at top and worst performers, and then consider stock and cash allocation strategies for 2024."
124752082,2023-12-28 17:15:43,n/a,Tesla: Car buyers missing out 'because they don't like Elon',"Challenges for EV maker Tesla (TSLA) in 2024 could be exacerbated by CEO Elon Musk's many responsibilities as head of several companies and his remarks made on X.com. Gerber Kawasaki Wealth & Investment Management CEO Ross Gerber sits down with Yahoo Finance Live to talk about the lasting impact of Musk's behavior on Tesla's performance. ""If Musk's behavior continues to get more and more extreme, that is a risk to Tesla sales,"" Gerber, a long-time Tesla bull, says. ""But the bottom line... it's the best vehicle on the road, it's the best value on the road. So, consumers literally have to buy a lesser car because they don't like Elon."" For more Yahoo Finance coverage of Tesla: Morgan Stanley, Starbucks, Tesla: 2024 leadership in focus Tesla: Is Elon Musk too distracted by his other companies? Catalysts for Tesla stock in 2024 Tesla is 'the AI company': Analyst Musk's social commentary hurting Tesla, other brands: Bill George For more expert insight and the latest market action, click here to watch this full episode of Yahoo Finance Live."
124752083,2023-12-28 16:54:31,n/a,"Musk's social commentary hurting Tesla, other brands: Bill George","All eyes have been on Tesla (TSLA) CEO Elon Musk as of late, from his managing of his several other ventures — The Boring Company, SpaceX's Starlink satellite, X.com — as well as his controversial social commentaries. It seems as though Musk may be stretched too thin to lead Tesla to its goals against mounting challenges in 2024. Former Medtronic CEO Bill George joins Yahoo Finance to weigh in on Musk's image and capabilities as a leader going forward. ""Investors that are going to look at the product and how it does, unless it is social commentaries, but I do think it's having an overall negative impact on his image,"" George states. ""And, frankly, it's hurting people. And he needs to get back to a civil network, if he could take X... and make it more like LinkedIn where we had more civil discourse, it would be a lot better off."" For more Yahoo Finance coverage of Tesla: Morgan Stanley, Starbucks, Tesla: 2024 leadership in focus Tesla: Is Elon Musk too distracted by his other companies? Catalysts for Tesla stock in 2024 Tesla is 'the AI company': Analyst Tesla: Car buyers missing out 'because they don't like Elon' For more expert insight and the latest market action, click here to watch this full episode of Yahoo Finance Live."
124759657,2023-12-28 16:46:19,n/a,Morgan Stanley Breaks Down $380 Price Target on Tesla Stock,"The question frequently raised on Wall Street revolves around whether Tesla (NASDAQ:TSLA) should be classified as an automotive company or as a technology company. Morgan Stanley’s Adam Jonas has a convenient solution to that issue. Essentially, why should you have to choose between the two? “In our discussions, many investors still debate the merits of Tesla as ‘more than an auto company,’ the analyst said. “In our opinion, Tesla is definitely an auto company. It is also an AI company. Think ‘a"
124752084,2023-12-28 16:38:33,n/a,Tesla is 'the AI company': Analyst,"Tesla CEO Elon Musk (TSLA) has come under fire for his comments on X (formerly Twitter). But Canaccord Genuity Managing Director George Gianarikas isn't concerned about what sort of impact it could have on the EV maker. Gianarikas argues that Musk's antics are not new and that ""he's who you have to take in to invest in Tesla's stock."" Tesla has missed some targets recently, but Gianarikas argues that when Musk is giving his goals, he's not just trying to please investors and Wall Street, but that ""he's trying to inspire the three, four, five companies that he's the CEO of and he navigates."" Gianarikas points to Tesla's full-self driving (FSD) technology. He thinks Tesla will succeed in meet its FSD goals. For example, Gianarikas says Tesla's FSD is relying ""completely on AI to navigate their vehicle"" and as a results he thinks Tesla is ""the AI company because ultimately real world AI is about self driving. You are literally taking AI to navigate a vehicle from one place to the other. There's no more productive use of AI out there."" For more Yahoo Finance coverage of Tesla: Morgan Stanley, Starbucks, Tesla: 2024 leadership in focus Tesla: Is Elon Musk too distracted by his other companies? Catalysts for Tesla stock in 2024 Tesla: Car buyers missing out 'because they don't like Elon' Musk's social commentary hurting Tesla, other brands: Bill George For more expert insight and the latest market action, click here to watch this full episode of Yahoo Finance Live."
124747376,2023-12-28 16:32:03,n/a,Believe it or not: China's new Xiaomi SU7 EV has its sights set on Porsche and Tesla,Chinese smartphone and device maker Xiaomi is targeting Porsche and Tesla with its just unveiled SU7 EV sedan.
124753089,2023-12-28 16:31:00,n/a,"Tesla Inc. stock falls Thursday, underperforms market","Shares of Tesla Inc. shed 3.16% to $253.18 Thursday, on what proved to be an all-around mixed trading session for the stock market, with the Dow Jones..."
124752086,2023-12-28 16:13:38,n/a,Catalysts for Tesla stock in 2024,"Tesla (TSLA) shares are up about 110% in 2023, but there are a few things that could keep powering the stock forward into next year. Yahoo Finance’s Madison Mills breaks down potential catalysts for Tesla that investors should keep an eye on in 2024, including the Cybertruck, a possible $25,000 car, and its Dojo supercomputer. For more Yahoo Finance coverage of Tesla: Morgan Stanley, Starbucks, Tesla: 2024 leadership in focus Tesla: Is Elon Musk too distracted by his other companies? Tesla is 'the AI company': Analyst Tesla: Car buyers missing out 'because they don't like Elon' Musk's social commentary hurting Tesla, other brands: Bill George For more expert insight and the latest market action, click here to watch this full episode of Yahoo Finance Live."
124752087,2023-12-28 16:04:00,n/a,Prominent investor foresees a lot of Big Tech acquisitions in 2024,"With just a few days left in 2023, Deepwater Management's Gene Munster looked back at his 2023 tech predictions and listed his expectations for what the sector might look like in 2024.  The bulk of his 2023 predictions, including waning electric vehicle sales, market performance and Apple  tech launches, panned out.  Munster additionally predicted that exercise equipment company Peloton  will be acquired by Apple, as the latter seeks to expand its exercise tech segment into fitness equipment."
